[
  {
    "requirement_id": "RC-00050",
    "evidence_id": "EV-00050",
    "domain": "DIGITAL_ASSET",
    "candidate_status": "CANDIDATE",
    "applicability": {
      "actor": "가상자산사업자",
      "data": [
        "이용자의 예치금"
      ],
      "processing_context": [
        "digital_asset_activity",
        "asset_segregation"
      ]
    },
    "source_derived_requirement": {
      "condition": "이용자의 예치금을 관리하는 경우",
      "required_action": [
        "이용자의 예치금을 고유재산과 분리하여 공신력 있는 기관에 예치 또는 신탁하여 관리하여야 한다"
      ],
      "prohibition": [],
      "exception": []
    },
    "interpretation_tags": [
      "DIGITAL_ASSET",
      "REVIEW"
    ],
    "deferred_runtime_considerations": [],
    "prohibited_runtime_decision": true,
    "review_note": "Requirement candidate only; does not decide ALLOW, BLOCK, TRANSFORM, transform method, or threshold."
  },
  {
    "requirement_id": "RC-00051",
    "evidence_id": "EV-00051",
    "domain": "DIGITAL_ASSET",
    "candidate_status": "CANDIDATE",
    "applicability": {
      "actor": "누구든지; 가상자산사업자",
      "data": [
        "예치금"
      ],
      "processing_context": [
        "digital_asset_activity",
        "asset_segregation"
      ]
    },
    "source_derived_requirement": {
      "condition": "관리기관에 예치 또는 신탁한 예치금",
      "required_action": [],
      "prohibition": [
        "관리기관에 예치 또는 신탁한 예치금을 상계ㆍ압류하지 못한다",
        "대통령령으로 정하는 경우 외에는 예치금을 양도하거나 담보로 제공하여서는 아니 된다"
      ],
      "exception": [
        "대통령령으로 정하는 경우"
      ]
    },
    "interpretation_tags": [
      "DIGITAL_ASSET",
      "REVIEW"
    ],
    "deferred_runtime_considerations": [
      {
        "source_tag": "BLOCK",
        "deferred_to": "GATEWAY_POLICY_OR_TRANSFORM_STAGE"
      }
    ],
    "prohibited_runtime_decision": true,
    "review_note": "Requirement candidate only; does not decide ALLOW, BLOCK, TRANSFORM, transform method, or threshold."
  },
  {
    "requirement_id": "RC-00052",
    "evidence_id": "EV-00052",
    "domain": "DIGITAL_ASSET",
    "candidate_status": "CANDIDATE",
    "applicability": {
      "actor": "가상자산사업자",
      "data": [
        "이용자의 예치금"
      ],
      "processing_context": [
        "digital_asset_activity",
        "asset_segregation"
      ]
    },
    "source_derived_requirement": {
      "condition": "이용자의 예치금을 고유재산과 분리하여 관리기관에 예치 또는 신탁하여 관리할 때",
      "required_action": [
        "해당 관리기관과 다음 각 호의 사항이 포함된 계약을 체결해야 한다"
      ],
      "prohibition": [],
      "exception": []
    },
    "interpretation_tags": [
      "DIGITAL_ASSET",
      "REVIEW"
    ],
    "deferred_runtime_considerations": [],
    "prohibited_runtime_decision": true,
    "review_note": "Requirement candidate only; does not decide ALLOW, BLOCK, TRANSFORM, transform method, or threshold."
  },
  {
    "requirement_id": "RC-00053",
    "evidence_id": "EV-00053",
    "domain": "DIGITAL_ASSET",
    "candidate_status": "REVIEW_REQUIRED",
    "applicability": {
      "actor": "가상자산사업자",
      "data": [
        "가상자산사업자"
      ],
      "processing_context": [
        "digital_asset_activity"
      ]
    },
    "source_derived_requirement": {
      "condition": "?????",
      "required_action": [],
      "prohibition": [],
      "exception": []
    },
    "interpretation_tags": [
      "DIGITAL_ASSET",
      "REVIEW"
    ],
    "deferred_runtime_considerations": [],
    "prohibited_runtime_decision": true,
    "review_note": "Requirement candidate only; does not decide ALLOW, BLOCK, TRANSFORM, transform method, or threshold."
  },
  {
    "requirement_id": "RC-00054",
    "evidence_id": "EV-00054",
    "domain": "DIGITAL_ASSET",
    "candidate_status": "REVIEW_REQUIRED",
    "applicability": {
      "actor": "가상자산사업자",
      "data": [
        "가상자산거래"
      ],
      "processing_context": [
        "digital_asset_activity",
        "transaction_data"
      ]
    },
    "source_derived_requirement": {
      "condition": "?????",
      "required_action": [],
      "prohibition": [],
      "exception": []
    },
    "interpretation_tags": [
      "DIGITAL_ASSET",
      "REVIEW"
    ],
    "deferred_runtime_considerations": [],
    "prohibited_runtime_decision": true,
    "review_note": "Requirement candidate only; does not decide ALLOW, BLOCK, TRANSFORM, transform method, or threshold."
  },
  {
    "requirement_id": "RC-00055",
    "evidence_id": "EV-00055",
    "domain": "DIGITAL_ASSET",
    "candidate_status": "REVIEW_REQUIRED",
    "applicability": {
      "actor": "",
      "data": [
        "가상자산"
      ],
      "processing_context": [
        "digital_asset_activity"
      ]
    },
    "source_derived_requirement": {
      "condition": "????",
      "required_action": [],
      "prohibition": [],
      "exception": []
    },
    "interpretation_tags": [
      "DIGITAL_ASSET",
      "REVIEW"
    ],
    "deferred_runtime_considerations": [],
    "prohibited_runtime_decision": true,
    "review_note": "Requirement candidate only; does not decide ALLOW, BLOCK, TRANSFORM, transform method, or threshold."
  },
  {
    "requirement_id": "RC-00056",
    "evidence_id": "EV-00056",
    "domain": "DIGITAL_ASSET",
    "candidate_status": "REVIEW_REQUIRED",
    "applicability": {
      "actor": "가상자산을 이전하는 가상자산사업자",
      "data": [
        "?? ? ?? ??"
      ],
      "processing_context": [
        "digital_asset_activity",
        "transaction_data",
        "third_party_or_outsourcing"
      ]
    },
    "source_derived_requirement": {
      "condition": "????? ????",
      "required_action": [
        "????? ???? ????????? ?? ? ?? ??? ??? ?"
      ],
      "prohibition": [],
      "exception": []
    },
    "interpretation_tags": [
      "DIGITAL_ASSET",
      "REVIEW"
    ],
    "deferred_runtime_considerations": [],
    "prohibited_runtime_decision": true,
    "review_note": "Requirement candidate only; does not decide ALLOW, BLOCK, TRANSFORM, transform method, or threshold."
  },
  {
    "requirement_id": "RC-00057",
    "evidence_id": "EV-00057",
    "domain": "DIGITAL_ASSET",
    "candidate_status": "REVIEW_REQUIRED",
    "applicability": {
      "actor": "",
      "data": [
        "가상자산주소"
      ],
      "processing_context": [
        "digital_asset_activity",
        "transaction_data",
        "wallet_address"
      ]
    },
    "source_derived_requirement": {
      "condition": "?????? ? ????",
      "required_action": [],
      "prohibition": [],
      "exception": []
    },
    "interpretation_tags": [
      "DIGITAL_ASSET",
      "WALLET",
      "LOG",
      "REVIEW"
    ],
    "deferred_runtime_considerations": [],
    "prohibited_runtime_decision": true,
    "review_note": "Requirement candidate only; does not decide ALLOW, BLOCK, TRANSFORM, transform method, or threshold."
  },
  {
    "requirement_id": "RC-00058",
    "evidence_id": "EV-00058",
    "domain": "DIGITAL_ASSET",
    "candidate_status": "CANDIDATE",
    "applicability": {
      "actor": "가상자산사업자",
      "data": [
        "가상자산 이전거래",
        "개인지갑"
      ],
      "processing_context": [
        "digital_asset_activity",
        "wallet_address",
        "transaction_data"
      ]
    },
    "source_derived_requirement": {
      "condition": "해외 가상자산사업자 및 개인지갑과의 거래",
      "required_action": [
        "자금세탁방지 의무 부과"
      ],
      "prohibition": [],
      "exception": []
    },
    "interpretation_tags": [
      "DIGITAL_ASSET",
      "WALLET",
      "REVIEW"
    ],
    "deferred_runtime_considerations": [],
    "prohibited_runtime_decision": true,
    "review_note": "Requirement candidate only; does not decide ALLOW, BLOCK, TRANSFORM, transform method, or threshold."
  },
  {
    "requirement_id": "RC-00059",
    "evidence_id": "EV-00059",
    "domain": "DIGITAL_ASSET",
    "candidate_status": "CANDIDATE",
    "applicability": {
      "actor": "금융기관",
      "data": [
        "고객 신원",
        "실제소유자 여부",
        "거래 목적"
      ],
      "processing_context": [
        "customer_due_diligence",
        "digital_asset_activity"
      ]
    },
    "source_derived_requirement": {
      "condition": "고객과 거래 시",
      "required_action": [
        "고객의 신원, 실제소유자 여부, 거래 목적 등을 파악하는 등 합당한 주의를 기울인다"
      ],
      "prohibition": [],
      "exception": []
    },
    "interpretation_tags": [
      "DIGITAL_ASSET",
      "REVIEW"
    ],
    "deferred_runtime_considerations": [
      {
        "source_tag": "DETECT",
        "deferred_to": "GATEWAY_POLICY_OR_TRANSFORM_STAGE"
      }
    ],
    "prohibited_runtime_decision": true,
    "review_note": "Requirement candidate only; does not decide ALLOW, BLOCK, TRANSFORM, transform method, or threshold."
  }
]
